207,AA,1143,TPA,DFW,3,360,170,0,aogYWd,Vernen,Ivakhnov,Male,90,China,Mullewa Airport,AU,Australia,OC,Oceania,9/10/2022,MXU,Lidia Kleinert,Delayed,Aer Lingus,9,"""Very positive experience""",27th June 2023,TRUE,"  Cork to Dubrovnik return. Comfortable aircraft , Cork based crews very chatty and engaging. Legroom good. Cheapest fare allows 10kg checked luggage. This means very few suitcases on board. No fighting for locker space so no mad rush for boarding. Very positive experience at a very good price.",A320,Family Leisure,Economy Class,Cork to Dubrovnik,Jun-23,4,5,,4,,,5,yes,satisfied,Loyal Customer,34,Personal Travel,Eco,2139,0,3,0,3,1,0,1,1,1,3,3,1,4,1,0,0
208,AA,1215,DCA,DFW,3,360,210,0,4NFJfo,Rufus,Bernardini,Male,57,Peru,Elkhart Municipal Airport,US,United States,NAM,North America,11/29/2022,EKI,Brittan Barends,Cancelled,Aer Lingus,1,"""customer service is non existent""",25th June 2023,FALSE, If you have to book with them and have no other option please consider buying air tags and if you are traveling with someone make sure you mix the clothing and belongings so that you don‚Äôt end up having to buy an entire new closet for your trip. They lost our luggage and it‚Äôs been 4 days now without our stuff and the customer service is non existent. I think that maybe a group of mice could better figure out how to locate a lost bag better than these humans. I will never fly with them again and will warn others in the NYC area to do the same.,,Couple Leisure,Economy Class,New York to Naples via Dublin ,Jun-23,1,1,1,1,1,1,1,no,satisfied,Loyal Customer,19,Personal Travel,Eco,2493,0,3,0,3,4,0,4,4,4,1,2,1,3,4,3,3
209,AA,1225,COS,DFW,3,360,120,0,ZYCfyO,Dorothea,Rogister,Female,45,Sweden,Osijek Airport,HR,Croatia,EU,Europe,6/24/2022,OSI,Trevor Braunston,On Time,Aer Lingus,1,"""not had a refund 18 months later""",20th June 2023,TRUE,"  Had booked back 2021 to fly from Manchester to New York via Dublin in September of that year, Aer Lingus then cancelled the flight from Manchester to Dublin and we changed to the direct service that was due to start in November 2021 which was also later cancelled. We opted for a refund and after hundreds of emails and phone calls I have still not had a refund 18 months later. This airline is useless and will never fly with them again!",,Couple Leisure,Economy Class,Manchester to New York JFK,May-23,1,1,,1,,,1,no,satisfied,Loyal Customer,67,Personal Travel,Eco,2041,0,3,0,3,5,0,5,5,3,1,5,4,1,5,0,0
210,AA,1406,OMA,DFW,3,360,125,0,Sjt3GB,Myrtie,MacScherie,Female,41,Laos,Pune Airport,IN,India,AS,Asia,2/19/2022,PNQ,Claude Ashington,On Time,Aer Lingus,1,"""ashamed and embarrassed""",18th June 2023,TRUE," A lovely flight from Dublin to San Francisco - could not fault it. Things went rapidly downhill after that, and Aer Lingus complete lack of regard for paying customers became all to apparent. Our luggage went missing and Aer Lingus have been rude and unhelpful. As a customer I am so disappointed in the customer service provided by my national airline. As an Irish person I'm ashamed and embarrassed to think that other people may be subjected to this treatment. This is not the image I want my national airline to be portraying of Ireland and Irish people. We have a short six day holiday in San Diego; Day 1 is now gone because of Aer Lingus complete and total lack of regard and concern for paying customers. We paid ‚Ç?808.50 for our flights (2 people) and it is disgusting to think that once they got our money they no longer care. Shame on you Aer Lingus.",A330,Solo Leisure,Economy Class,Dublin to San Francisco,Jun-23,3,5,5,1,3,1,1,no,satisfied,Loyal Customer,63,Personal Travel,Eco,858,0,3,0,3,4,2,3,1,1,0,1,3,1,2,0,0
211,AA,1584,LAS,DFW,3,360,160,0,AFH4wB,Carley,Gowers,Female,19,Poland,Dien Bien Phu Airport,VN,Viet Nam,AS,Asia,8/19/2022,DIN,Gabriello Slinn,Delayed,Aer Lingus,1,"""Lost luggage nightmare""",17th June 2023,FALSE," WORSE THAN SPIRIT AIRLINES! Lost luggage nightmare! This is easily the worst and least helpful airline I‚Äôve ever dealt with. I‚Äôd even recommend Spirit Airlines over Aer Lingus. They lost our bags on our recent trip and have no desire to help us get them back. Their customer service is a joke and they are incapable of providing any answers to help us understand when we can expect the bags. Besides this nightmare we‚Äôve experienced, the planes are also small and uncomfortable. Will never fly with them again!",,Couple Leisure,Economy Class,Washington to Naples via Dublin,Jun-23,1,1,1,1,1,1,1,no,satisfied,Loyal Customer,29,Personal Travel,Eco,2383,0,3,0,3,5,0,5,5,3,2,3,3,3,5,0,0
212,AA,1596,PDX,DFW,3,360,225,0,1fOagM,Flin,Bordone,Male,87,Philippines,Leinster Airport,AU,Australia,OC,Oceania,8/21/2022,LER,Hunt Sommerlie,Delayed,Aer Lingus,7,"""would certainly use them again""",14th June 2023,TRUE," Our outbound flight was excellent with no issues and on 10 June for our return flight, I have one big issue and some niggles. For the whole flight, the cabin crew locked off one of the two available toilets. There was nothing wrong with it as the cabin and flight crew used it. Keeping a toilet exclusively for crew use is, in my view, unacceptable. The seat on the A330 is comfortable and I had the best 4 hours of continuous sleep I have ever had in the air. The food offering was, for me, poor except for the snack just after take off with the first drink service. It comprised a pack of five mini, savoury biscuits and a little tub of onion chutney to dip, both of which were delicious and very different from the nuts or pretzels others offer. On the outbound flight, we were offered the traditional juice or champagne prior to take off but no attempt was made to offer this on the inbound flight. The Asian-style beef at dinner had little of the Orient about it. I didn't try the dessert or either of the starters. IFE was available but very limited choice compared to many other carriers. Finally the complimentary wi-fi was somehow not available on this leg but you could pay. Outbound no problem a voucher was given shortly after boarding. Okay, quite a bit of whinging there, and apart from the very comfortable seat the only other positive was that despite delayed take off on both legs the plane arrive on time or a little early. I would certainly use them again for this route though as too few Manchester to the USA options are available.",A330,Couple Leisure,Business Class,New York JFK to Manchester,Jun-23,5,4,3,5,2,1,4,yes,satisfied,Loyal Customer,51,Personal Travel,Eco,748,0,3,0,3,3,4,5,2,2,0,2,2,2,2,0,0
213,AA,1602,ELP,DFW,3,360,100,0,TtHhBl,West,Kernermann,Male,86,Norway,Valle Airport,US,United States,NAM,North America,5/19/2022,VLE,Rosamund Gauchier,Cancelled,Aer Lingus,2,"""Never again will I fly Aer Lingus""",14th June 2023,TRUE,"  We booked a ten-day tour of Ireland thru Trafalgar Tours. The tour started 19 May 2023. We wanted to arrive early and see some of Dublin before the tour started so we booked an Aer Lingus flight from Orlando Florida to Dublin on the 17th of May. Our flight was due to depart at 8:30 PM and arrive in Dublin at 9:30 AM on the 18th of May. (Aer Lingus Flt. 120). We were told that the incoming equipment had been delayed and that we would depart at 9:30 PM. The incoming aircraft arrived shortly after 9 PM followed by a fire truck! We were told we would depart at 10;30 then, 11:30. this went on till 2 AM on the 18th. They said the flight was canceled, but we would be boarded in the morning as soon as the aircraft was repaired. Imagine 300 people scrambling to get their checked luggage and make their way to the check in desk to get a hotel voucher (we found out that they booked the hotel rooms at 9:00 PM that night), madness. We got to the hotel at 4:30 AM. We had three hours sleep and returned to the airport to see if our plane had been repaired, it hadn't. we were told we would be boarding Aer Lingus flight 34 for Manchester, England at 5:45 PM. We arrived in Manchester at 7:20 AM on the 19th of May. Our connecting flight (Aer Lingus 3327) to Dublin did not leave till 5:45 PM that night. We arrived in Dublin at 6:40 PM. We arrived 33 hours late. We had paid for a hotel room in Dublin for the night of the 18 that we didn't get to use, and we missed the complete first day of our tour. We filed a claim with Aer Lingus for $ 600 each for me and my wife per EU rules. We also asked for $220 for the hotel room we had paid for, $174 for meals and $800 for the first day of the tour that we missed out on. They have offered us $147 in total compensation although they are responsible for our losses. Never again will I fly Aer Lingus or say a good word about them. ",A330,Family Leisure,Economy Class,Orlando to Dublin,May-23,3,4,4,3,4,4,2,no,satisfied,Loyal Customer,22,Personal Travel,Eco,1421,0,3,0,3,2,3,2,2,5,4,5,2,4,2,0,9
214,AA,1615,BDL,DFW,3,360,260,0,Z6AUHY,Brien,Gatherer,Male,22,Poland,Etadunna Airport,AU,Australia,OC,Oceania,4/26/2022,ETD,Liv Lydall,On Time,Aer Lingus,3,"""Aer Lingus the new Ryanair""",13th June 2023,FALSE,"  Had a connecting flight from Heathrow to Shannon. Flight was suddenly cancelled. I was told very rudely, you have 2 options, sit in the airport for 17 hours until tomorrow or move to Dublin. But you will then have to have a 3 hour bus journey to Shannon. What is so frustrating is this is a very regular occurrence, receive no apologies, then was made sit on the runway for 2+ hours without being able to purchase so much as a chocolate bar. I have been running from gate to gate like a headless chicken and have has no time to stop for some food. I'm starving. ""No we cannot give you anything to eat/buy until we are in the air"". Waited ages for flight then bus to take off, rushed again, no toilet on bus or time to run to shop. No where to charge phone to arrange a lift. 3 hour cold bus journey starved after that. Awful experience, will never fly Aer Lingus again. Obvious lies all the time, excuses for everything that were not even good ones. We got a free plastic glass of water from a 2 litre bottle and at no stage when people complained did anyone say 'Sorry'. Ryanair has become the new Aer Lingus and Aer Lingus the new Ryanair. Lots of extras costs to be as a result. Aer Lingus will regularly cancel Heathrow to Shannon on a Monday if the flight is not full to save them some $. Unethical!",,Business,Economy Class,London Heathrow to Shannon,Jun-23,1,1,1,1,,,1,no,satisfied,Loyal Customer,9,Personal Travel,Eco,2037,0,3,0,3,3,0,3,3,3,4,3,2,3,3,0,1
215,AA,1631,MSY,MIA,3,360,105,0,Eg2XKv,Ephrayim,Bedford,Male,6,China,Kasenga Airport,CD,"Congo, The Democratic Republic of the",AF,Africa,10/16/2022,KEC,Park Thody,On Time,Aer Lingus,1,"""didn't deliver what I paid for"" ",13th June 2023,FALSE,"¬†I booked round-trip from Boston (BOS) to Amsterdam (AMS). Then I paid $500 extra to change to round-trip from Hartford (BDL) to Amsterdam (AMS) when Aer Lingus started flying out of BDL. Six hours before the flight, Aer Lingus cancelled BDL and had me fly out of BOS. I asked them to change the return flight to BOS since my car would be parked there. They said that would be another upcharge, which I refused. I requested a refund of the $500 since they didn't deliver what I paid for. They rejected the request. So on top of the $500, I had to buy an Amtrak ticket from Hartford to Boston to get my car and pay for two extra days of parking at BOS. This is unacceptable. I urge anyone considering Aer Lingus to reconsider.",,Family Leisure,Economy Class,Boston to Amsterdam via Dublin ,Mar-23,3,3,3,1,3,1,1,no,satisfied,Loyal Customer,57,Personal Travel,Eco,679,0,3,0,3,4,1,3,4,4,0,4,3,4,3,0,0
216,AA,1670,AUS,ORD,3,360,165,0,EdE25t,Kaitlin,Gaven,Female,30,Sao Tome and Principe,Wabush Airport,CA,Canada,NAM,North America,9/06/2022,YWK,Leshia Risby,Cancelled,Aer Lingus,1,"""absence of an apology""",11th June 2023,TRUE,"  On May 6 flight , I was flying in Business Class from Dublin to Boston. I had expected an exceptional level of service, comfort, and attention to detail. Regrettably, my experience fell far short of these expectations. when I received my meal onboard. To my dismay, I discovered a disturbing bug in one of the dishes. This discovery was not only highly unappetizing but also raised serious concerns about the hygiene and quality control standards. Such a glaring oversight in food preparation is simply unacceptable. What adds insult to injury is the complete lack of acknowledgment or apology from any representative of the airline. I was astounded by the disregard for customer satisfaction and the absence of any effort to rectify the situation or offer an explanation. The absence of an apology or any form of follow-up after such a distressing incident further compounds my disappointment.",,Business,Business Class,Dublin to Boston,May-23,1,1,1,1,,,1,no,satisfied,Loyal Customer,26,Personal Travel,Eco Plus,2237,0,3,0,3,4,0,1,4,2,4,3,2,4,4,2,0
217,AA,1755,ABQ,DFW,3,360,105,0,sXLYBV,Tobe,Torrejon,Female,12,Brazil,Schefferville Airport,CA,Canada,NAM,North America,4/05/2022,YKL,Gaelan Fforde,Cancelled,Aer Lingus,7,"""have concerns over the baggage fees""",4th June 2023,TRUE,  Aer Lingus ‚Ä?Flight E1 178 on 4th June 2023. Dublin to London Heathrow. I shall start this review by firstly referring to the online booking experience. While the website is clear the added on fees such as seat selection and charges for baggage leave a bitter taste. I was livid to see that some passengers brought aboard bags larger than the one I paid to have in the hold based on the online information. Boarding was not efficient as there was no priority boarding for needy categories of passengers. Moreover the person checking & scanning the boarding pass did not even make eye contact and was using her mobile phone with one hand while scanning boarding passes with the other! This is unprofessional and something I have not seen before! Most of the cabin crew had a low profile with the exception of one very hard working lady who went above and beyond to assist and elderly couple. It was nice that some announcements were made in the Irish language as well as in English. The flight arrived ahead of schedule and disembarkation was efficient but again cabin crew other than the same hard working lady were invisible. The flight was operated by an A320 neo. This was ideal for such a short but very busy flight. The captain made clear announcements and safety was taken seriously. I would use Aer Lingus again but have concerns over the baggage fees.,A320 neo,Solo Leisure,Economy Class,Dublin to London,Jun-23,5,2,,2,,,3,yes,satisfied,Loyal Customer,7,Personal Travel,Eco,1871,0,3,0,3,5,0,5,5,1,5,3,1,4,5,0,0
218,AA,1839,OKC,DFW,3,360,60,0,iTEytl,Trudey,Wagge,Female,7,Poland,Kalaupapa Airport,US,United States,NAM,North America,4/27/2022,LUP,Manya Vaun,On Time,Aer Lingus,1,"""this airline is horrible""",28th May 2023,TRUE,"  They didn‚Äôt put our golf clubs on our flight on both legs to and from Edinburgh to Dublin. They lied and said they were on the flights when asked. We watched them unload them. We took photos of this. We had AirTags in our bags and were able to track. They constantly lied to us about them looking for them. They make you fill out a report and you never hear from them again. Through a third party we were able to have our clubs picked up, without the airline even knowing. The customer service staff is ignorant and unhelpful. Very unprofessional all the way the senior person who just couldn‚Äôt be bothered and didn‚Äôt care. There were 8 of us and this happened to 7 of 8. Worst flying experience. Everyone we spoke to in Edinburgh said this was a regular occurrence with this airline. If we didn‚Äôt have the AirTags we would have been out our clubs. Find another option, this airline is horrible.",,Business,Business Class,Edinburgh to Toronto via Dublin,May-23,2,1,1,1,1,1,1,no,satisfied,Loyal Customer,12,Personal Travel,Eco,1856,0,3,0,3,1,0,1,1,1,1,3,1,4,1,0,0
219,AA,1843,BOS,ORD,3,360,175,0,ffzpvV,Gene,Cottham,Male,56,Philippines,Victoria Harbour Seaplane Base,CA,Canada,NAM,North America,1/12/2022,YWH,Sib Feragh,Delayed,Aer Lingus,3,"""My flight was delayed by 3 hours""",28th May 2023,TRUE,"  My flight was delayed by 3 hours which made me miss my bus home which is 4 hours from Dublin. I then had to wait an hour after arriving in Dublin to get another bus that wasn‚Äôt even going to my home, it stopped 40 mins away so I had to arrange for someone to pick me up from there. I‚Äôm very disappointed with there service and have never been as stressed in my life and I didn‚Äôt think I was going to make it home.",,Solo Leisure,Economy Class,Edinburgh to Dublin,May-23,4,5,1,4,,,4,no,satisfied,Loyal Customer,17,Personal Travel,Eco,1865,0,3,0,3,2,0,4,2,5,3,1,5,2,2,0,0
220,AA,1878,SMF,DFW,3,360,205,0,Y6UXKx,Seline,Garvill,Female,30,Philippines,Columbus Lowndes County Airport,US,United States,NAM,North America,1/13/2022,UBS,Dael Schubuser,Cancelled,Aer Lingus,2,"""over 12 hours of delay""",27th May 2023,TRUE,"  Our flight from Chicago to Dublin was delayed and our connecting flight to Z√ºrich did not wait in Dublin. No big deal, we thought. Usually airlines would route us to the final destination without much fuss. Not the case with aer Lingus. Aer Lingus doesn‚Äôt have relationship with most major airlines. So you are presented with very limited choices. Our best case alternative routing presented was over 12 hours of delay from the original time. We even asked for a direct connection the next day but they didn‚Äôt have flights to Z√ºrich on Sunday. So the next flight was two days away. We took the alternate route they provided. We were not provided any compensation or voucher.  We had to take the checked bags out at Ireland and go through immigration to get the rebooking done and had to check in afresh again. They provided boarding passes only until Amsterdam and not to the final destination Z√ºrich. The baggage tag was also to Amsterdam. I raised concern over that. The agent said we should collect our bags again at Amsterdam and recheck and collect boarding passes at Amsterdam at KLM counter. The flight to Amsterdam was delayed by two hours. When we reached Amsterdam, we had to go through immigration and collect the bags again. We did that and when we went to check in the bags, we were told that their system doesn‚Äôt show that we paid for the bags and we have to pay again. We paid for 30 kg check in bags. Due to Aer Lingus's fault, we now have to pay again for the baggage (55 euro) and an excess baggage fee of 75 euro. Not only that, we had to visit six different counters to get this issue resolved. We spent well over four hours going from counter to counter with kids and bags. Klm staff asked us to pay them and seek reimbursement from aer lingus. When we contacted aer Lingus via them WhatsApp business account, they asked to register a case at their website and provided a link. After filling out all the details meticulously, the form crashes with a server error. Wow. Please don‚Äôt ruin your trip / vacation flying Aer Lingus.",,Family Leisure,Economy Class,Chicago to Zurich via Dublin,May-23,4,3,3,1,3,3,2,no,satisfied,Loyal Customer,58,Personal Travel,Eco,437,0,3,0,3,3,3,3,4,4,0,4,3,4,3,0,0
221,AA,1921,EWR,MIA,3,360,185,0,YxzFXA,Neil,McCory,Male,54,Portugal,Centralia Municipal Airport,US,United States,NAM,North America,3/24/2022,ENL,Odella Gregoretti,Cancelled,Aer Lingus,1,"""Amazing customer service""",24th May 2023,TRUE, Amazing customer service at the gate. I missed my original flight though my own error and the gentleman at the gate couldn‚Äôt have been nicer put me on the next flight to London with no hesitation and no judgement. I‚Äôm so appreciative to have been treated this way. Thank you Aer Lingus.,,Business,Economy Class,Dublin to London,May-23,5,5,,5,,,5,yes,satisfied,Loyal Customer,14,Personal Travel,Eco,1343,0,3,0,3,4,0,4,4,2,3,3,4,4,4,0,0
222,AA,1965,STL,DFW,3,360,115,0,sTJQEz,Burty,Blurton,Male,33,China,Mariupol International Airport,UA,Ukraine,EU,Europe,8/09/2022,MPW,Leonora Holah,On Time,Aer Lingus,1,"""our luggage has not been located""",23rd May 2023,FALSE," There are lots of choices when booking a flight. We happened to be celebrating a milestone wedding anniversary and booked a trip to Italy. The flight itself was fine. We arrived at the airport in Naples and were the only passengers on a flight of 300+ people to be standing at the baggage carousel when it shut down because all the bags had been picked up by the passengers except for us. Our bags were missing. So now we head over to the missing baggage window and fill out a missing baggage claim form. This is Sunday morning. We make our way to the hotel with the clothes on our back for a week long stay to celebrate our anniversary not sure where our luggage is. We are tired. We have been on two flights for 10 hours. We wake up the next morning and put on the same clothes we arrived in to get breakfast. Never mind that there are new outfits in our luggage that we purchased for this trip that are floating around somewhere. After calling Aer Lingus multiple times and being told our luggage is out for delivery, we logged on to their missing baggage website only to learn our luggage has not been located yet in spite of Aer Lingus agents lying and telling us on the phone our bags were on the way. Was this so we wouldn‚Äôt go out and purchase necessary items to change into to keep Aer Lingus lost baggage costs lower. We are now in our 3rd full day in Italy and Aer Lingus still stands by their claim that one bag is out for delivery, when the truth of the matter is they can‚Äôt specify where it is en route. This saga will probably continue for us long after we depart Italy in two days. To add insult to injury, Aer Lingus cannot tell us what is acceptable and necessary that we can purchase while we wait hopelessly for our luggage. Talk about being given the run around, reading from a computer screen that the bags are in route, escalating our calls to supervisors who only read the same script on a screen. My Advice to Everyone out there - DO NOT BOOK YOUR FLIGHT through Aer Lingus if you value the peace of mind that you are entrusting a company that values it‚Äôs customers and will make a sincere effort to correct an error in a timely and honest manner. Let‚Äôs face it, a lot of people are like us, we don‚Äôt travel all the time, we spent thousands of hard earned dollars, and to be in Europe for going on four days in the same skivvies we arrived in should not be tolerated by customers - so book with another airlines if you value peace of mind.",A330,Couple Leisure,Economy Class,Boston to Naples via Dublin,May-23,3,4,4,1,1,1,3,no,satisfied,Loyal Customer,57,Personal Travel,Eco,374,0,3,0,3,3,3,3,2,2,0,2,1,2,2,0,0
223,AA,1994,IAH,MIA,3,360,135,0,Suny9v,Mead,Syer,Male,79,Venezuela,Jiayuguan Airport,CN,China,AS,Asia,5/29/2022,JGN,Monique Edworthye,On Time,Aer Lingus,8,"""I am happy to spend money with them""",19th May 2023,FALSE,"  I travel a lot for my job and have lived in several different countries and so regularly use many different airlines. Although Aer Lingus are not always perfect, in my opinion they are one of the better and more reliable airlines today. They are reasonably quick to refund when there has been a problem, reasonably fair in their assessments of grievances and generally better at professional communication than most. There's definitely room for improvement but overall I am happy to spend money with them as I have seen they care about the quality of their services when it matters the most, i.e. when there has been a problem.",,Business,Premium Economy,Dublin to Geneva,May-23,3,4,4,4,3,3,4,yes,satisfied,Loyal Customer,55,Personal Travel,Eco,1422,0,3,0,3,1,0,1,1,2,4,3,3,3,1,97,96
