133,DL,2939,DCA,ATL,3,345,120,1,jGK7IW,Rory,Wank,Female,84,Japan,Ilam Airport,IR,"Iran, Islamic Republic of",AS,Asia,10/21/2022,IIL,Yoshiko Agastina,Cancelled,Aegean Airlines,2,"""you will not get any support if something goes wrong""",3rd November 2022,TRUE," Although my flight was not delayed or canceled, I had a horrible experience. My luggage was damaged and I have submitted my complaint immediately. I have also documented everything with photos and requested a refund, but I only received confirmation that my complaint was recorded and since then, the company keeps ignoring my e-mails. Also, I got charged extra 40 euros for having an additional piece of luggage only when departing my destination and not on the other three flights (I had one stop at Athens). I am very disappointed with Aegean, so I do not recommend it to others because you will not get any support if something goes wrong.",,Business,Economy Class,Belgrade to Chania,Sep-22,2,4,3,2,1,1,3,no,satisfied,Loyal Customer,33,Personal Travel,Eco,1949,0,2,0,3,5,0,2,5,3,2,4,3,3,5,0,0
134,EV,5142,AEX,ATL,3,345,119,0,7j5g5M,Modesty,Zink,Female,11,Ukraine,Soledade Airport,BR,Brazil,SAM,South America,10/03/2022,0,Charissa Figures,Cancelled,Aegean Airlines,1,"""One of the best airline apps I have tried so far!""",26th October 2022,TRUE," Great airline! I fly regularly with Aegean Airlines, and it is always my number one choice. Especially the new planes are really nice, and the service on board is good too. The food is really not that bad, especially in business class. However, Economy is great as well. There are some nice touches with Aegean, like how they inform you when your flight is delayed. They email you, and you get a notification in the app. About the app, it works really good. One of the best airline apps I have tried so far! I don't have any complaints. Even after dozens of flights, no problems at all!",A321NEO and A321,Solo Leisure,Economy Class,Madrid to Heraklion via Athens,Oct-22,4,5,4,5,,5,5,yes,satisfied,Loyal Customer,64,Personal Travel,Eco,419,0,2,0,3,3,4,3,1,1,0,1,3,1,1,0,0
135,EV,5218,SYR,ATL,3,345,158,0,K4mE4H,Newton,Berni,Male,52,Argentina,Helenvale Airport,AU,Australia,OC,Oceania,5/02/2022,HLV,Rouvin Siflet,Delayed,Aegean Airlines,1,"""My bag was delayed""",10th October 2022,TRUE,"  Worst baggage experience ever. My bag was delayed at my connection in Athens on 9th August 2022 and Aegean has not responded to my request for first need expense, multiple attempts to reach them via email, and when I called the automated line said ""We do not have the resources to handle your request"" The worst part is I paid extra to check my bag.",,Couple Leisure,Economy Class,Santorini to Athens,Aug-22,1,1,,1,,,1,no,satisfied,Loyal Customer,37,Personal Travel,Eco,1571,0,2,0,3,3,0,3,3,3,5,4,4,4,3,0,0
136,EV,5233,BTR,ATL,3,345,97,0,fe9vIa,Sybila,Troker,Female,8,Indonesia,Dalhart Municipal Airport,US,United States,NAM,North America,4/08/2022,DHT,Nelle Aldridge,On Time,Aegean Airlines,6,"""simply got worse in service""",6th October 2022,TRUE," Larnaca to Athens. I fly Aegean twice weekly almost every single week of the year. And I could say that 90% of the times their flights are delayed, specially the ones towards the end of the day. And it is not due to the overall mess that happened this past summer I'm so many European airpors. I can understand that delays pile up along the day but, knowing that this happens, they should review their schedules. Or try to catch up during the flight. The excuse is most times the same, the ridiculous ""late arrival of the aircraft"" (thank you!). Their app is also faulty lately (you call then, show them, and still don't accept it, things like not being able to check in, wrong pricing information, no incoming messages with flight delays, etc. Also, when they change planes and they cannot relocate you in a pay seat, you have to call them to get a refund! What they don't miss is to send a a silly survey upon landing asking about the quality of the service on board (""forcing"" you to chose an area of improvement!), while not asking for the end-to-end experience (from reservation, check in, baggage drop, boarding, disembarkation, luggage). They deserve some competition, they've simply got worse in service, unfortunately for those of us hooked to them.",A321 Neo,Business,Economy Class,Larnaca to Athens,Oct-22,3,3,3,3,3,,3,no,satisfied,Loyal Customer,61,Personal Travel,Eco,1119,0,2,0,3,3,0,3,3,2,1,4,3,4,3,2,0
137,EV,5362,SHV,ATL,3,345,123,1,Txixyg,Jewel,Betteney,Female,66,China,Yam Island Airport,AU,Australia,OC,Oceania,12/27/2022,XMY,Bonnee Summerson,On Time,Aegean Airlines,1,"""a very bad experience""",5th October 2022,TRUE," Santorini to Athens. We had a very bad experience with Aegean Airlines. I bought two tickets and by right have combined baggage of 46kgs - however, when we dropped off our baggage, the staff told us Aegean don't combine baggage and charged us for excessive baggage charges although our actual bags combined only 43kgs. Also they dont accept one of our hand carry suitcase as well which have been travelled through so many airlines like Qatar and Swiss with no issues and charge us another baggage charges. Unless you want to be ripped off by this airlines otherwise I highly unrecommend Aegean because they will find all their ways to rip you.",,Couple Leisure,Economy Class,Santorini to Athens,Oct-22,2,2,,1,,,1,no,satisfied,Loyal Customer,60,Personal Travel,Eco,1190,0,2,0,3,1,0,1,1,1,5,3,2,3,1,0,0
138,EV,5501,VLD,ATL,3,345,62,0,i8N6c7,Hobie,Skace,Male,70,China,St George Airport,AU,Australia,OC,Oceania,7/12/2022,SGO,Jenn Backshaw,Delayed,Aegean Airlines,1,"""dysfunctional bureaucracy""",1st October 2022,FALSE,"  Corfu to Skopje via Athens. On August 4, 2022, my husband and I were traveling from Corfu, Greece on Aegean 285 to Skopje, North Macedonia on Aegean 984 operated by Olympic. Upon arrival in Skopje we were informed our luggage had been lost. We filed a lost baggage report at the Skopje airport. Once in Skopje all we had was the clothes on our backs. We spent the first two days of our vacation milling around an unknown city trying to find clothing and personal items and dealing with Aegean Airlines dysfunctional bureaucracy. On August 10, 2022, we returned home to the States empty handed and no word from Aegean regarding our lost luggage. Our calls and emails went unanswered. 10 days later we finally received our luggage that was come how found in Austria. We filed a reimbursement claim for initial expenses accrued in Skopje, for personal items and clothing replacement. Once again no word from Aegean. I repeated this process 3 times to no avail. Aegean airlines is run by sociopaths. They pretend nothing happened on their watch and choose to ignore any problems that happen on their airline. Trust me when I say I am not the only one affected by these grifters.",,Couple Leisure,Economy Class,Corfu to Skopje via Athens,Aug-22,1,1,1,1,1,1,1,no,satisfied,Loyal Customer,28,Personal Travel,Eco,1844,0,2,0,3,4,0,4,4,2,5,4,3,3,4,1,0
139,OH,6264,BDL,CVG,3,345,133,0,zmLs0I,Loree,Fishpond,Female,37,Ukraine,Dallas Love Field,US,United States,NAM,North America,5/31/2022,DAL,Gaelan Kenyam,On Time,Aegean Airlines,5,"""luggage is delayed""",30th September 2022,TRUE,"  
Aegean Airlines forced me to check my hand luggage too without additional fee. I checked it in the departure airport (Yerevan) and when I arrived at my destination airport (Hamburg) I got a notification from Aegean app that my hand luggage which they forced me to check as a 2nd piece of luggage is delayed. In  Hamburg Airport I could not find the responsible person for Aegean Airlines who will help mein this situation. ",A321 / A321,Solo Leisure,Economy Class,Yerevan to Hamburg via Athens,Sep-22,4,5,3,1,1,,3,no,satisfied,Loyal Customer,26,Personal Travel,Eco,959,0,2,0,3,3,0,3,3,3,4,3,2,4,3,0,0
140,OH,6549,MFE,MEM,3,345,118,0,HJjcbN,Gauthier,Elsip,Male,33,Uruguay,Gerrard Smith International Airport,KY,Cayman Islands,NAM,North America,6/11/2022,CYB,Leslie Delmage,Cancelled,Aegean Airlines,1,"""had to buy my own meal""",20th September 2022,TRUE,  They delayed our departing flight so we missed the flight to our final destination. They then booked us a new flight the next day at 7 am but in order to make the flight we had to take a bus at 5 am. For the inconvenience they provided a complimentary food voucher to use in Athens. When I tried using the voucher the funds were not applied. The cashier told me to go speak with an Aegean Airline employee. I then went to speak with an Aegean Airline help desk employee and due to our language barrier she did not understand what I was telling her so I never got the funds and had to buy my own meal.,,Couple Leisure,Economy Class,Oslo to Santorini,Sep-22,2,5,2,1,,,1,no,satisfied,Loyal Customer,41,Personal Travel,Eco,2109,0,2,0,3,5,0,5,5,2,5,4,1,4,5,0,0
141,OO,6407,FAT,SFO,3,345,45,0,Dbnam6,Gisella,Watters,Female,35,Philippines,RAF Wildenrath,DE,Germany,EU,Europe,2/17/2022,WID,Sherwin Izen,Cancelled,Aegean Airlines,5,"""flight attendants were nice""",18th September 2022,TRUE,"  I recently had 2 flights with Aegean, both of which were not bad. RHO to ATH and ATH to AMS.  On the 2nd flight, I did see an attendant walking around the airport waiting room looking at bags, but she never weighed or measured anything. Both times the planes were delayed, though in their defense, most of the time I've flown in Europe pre and post pandemic, flights are delayed. The flight attendants were nice on both flights - always smiles and always helping. They never seemed to be unhappy, and some of the best I've encountered. I was impressed that they served a light meal and a beverage on my 3.5 hour flight and beer or wine didn't cost anything. Tui on the other hand, for the same length of flight, charged for food and/or drink and the leg room was much smaller, though their TUI allows 10kgs of carry-on luggage v. 8kgs for Aegean. I'd rather have the luggage allowance higher than the light meal and drink. The major thing that was scary was that almost everyone had left the airport in Athens before my moms luggage came off.",,Family Leisure,Economy Class,Rhodes to Amsterdam via Athens ,Sep-22,5,5,4,4,,,3,yes,satisfied,Loyal Customer,57,Personal Travel,Eco,317,0,2,0,3,5,2,3,1,1,0,1,4,1,4,0,0
142,OO,6647,BZN,DEN,3,345,107,0,qScvIX,Flora,Delgardillo,Female,51,Philippines,General Lucio Blanco International Airport,MX,Mexico,NAM,North America,10/19/2022,REX,Keeley Kiltie,On Time,Aegean Airlines,1,"""The best airline in Europe""",18th September 2022,TRUE,"  The best airline in Europe, professional cabin crew, comfortable seats and excellent service. It was a pleasure to fly with you. Keep up the good work and wishing you all the success.",A321 Neo,Solo Leisure,Economy Class,Prague to Cairo via Athens,Sep-22,5,5,5,5,,,5,yes,satisfied,Loyal Customer,47,Personal Travel,Eco,1977,0,2,0,3,2,0,2,2,2,2,2,4,2,2,0,0
143,OO,6925,PHX,LAX,3,345,85,0,XGQOHz,Dorthea,Wealleans,Female,6,China,Wantoat Airport,PG,Papua New Guinea,OC,Oceania,11/30/2022,WTT,Adi Sinclar,On Time,Aegean Airlines,4,"""passed only once for drinks""",17th September 2022,TRUE,  For a 3.45 hour Helsinki to Athens flight we got served a sandwich and the flight attendants passed only once for drinks. The airline has delays particularly at flights after the morning.,A320,Business,Economy Class,Helsinki to Athens,Sep-22,3,3,1,4,,,2,no,satisfied,Loyal Customer,61,Personal Travel,Eco,291,0,2,0,3,1,3,4,2,2,0,2,1,2,1,0,2
144,OO,6964,RDM,PDX,3,345,58,0,X2Ltf0,Arlyn,Boole,Female,45,Philippines,Sofia Airport,BG,Bulgaria,EU,Europe,1/20/2022,SOF,Cindie Critten,On Time,Aegean Airlines,2,"""luggage arrived nine and twelve days later""",11th September 2022,TRUE,"  Very early morning departure from Tbilisi with a crew that already worked through the night. The male purser, during the preflight information, informed transfer passengers to check luggage procedures in Athens in the inflight magazine - we did it and found out that connecting in Athens from Non-Schengen to Schengen means you have to pick up your luggage, take it through customs and check it in again. With the official 1:05h connecting time it sounded sporty. A biscuit, yogurt, and drinks were served as breakfast, then crew then went behind the curtains and did not show up again until the final approach to Athens. During the descent, they asked the passengers to put the garbage including cups with liquids into the seat pockets. Delayed by 40 minutes we landed in Athens. During taxiing, the purser advised transit passengers to rush to their gates. We made our connection by running and thanks to no traffic at the border guards. Our luggage arrived nine and twelve days later following a lengthy search, no support from Aegean Airlines, no answer to any call or any mail.",A321 classic,Couple Leisure,Economy Class,Tbislis to Frankfurt via Athens ,Jun-22,3,1,2,2,,,3,no,satisfied,Loyal Customer,29,Personal Travel,Eco,1820,0,2,0,3,1,0,1,1,2,1,3,1,3,1,0,0
145,US,1423,DCA,CLT,3,345,85,0,zXX2BI,Jameson,Sayce,Male,53,Brazil,Ant√¥nio Guerreiro Airport,BR,Brazil,SAM,South America,9/16/2022,GMS,Maddy Siuda,On Time,Aegean Airlines,6,"""Meal was good for a 90 min flight""",5th September 2022,TRUE,"  Athens to Beirut on an A321. Business class seat is the same as in Economy, hard and rather uncomfortable. Meal was good for a 90 min flight, both in quality and quantity, though I find the pasta with chicken combination weird. No champagne available, only sparkling wine, but good offer of beverages and Greek liquors. Crew young, well-groomed, with some members being somehow snobbish. No WiFi and no entertainment. Will not fly again such a product in Business. On the other side, the brand new Aegean business class at Athens airport for extra-Schenghen flights is quite impressive, in terms of decor, ambiance and food / drinks selection: well done Aegean.",A321,Solo Leisure,Economy Class,Athens to Beirut,Sep-22,2,4,4,4,,,3,yes,satisfied,Loyal Customer,67,Personal Travel,Eco,1721,0,2,0,3,5,0,5,5,4,1,3,3,4,5,9,0
146,XE,2919,LFT,IAH,3,345,58,0,YLxT9W,Collin,Ciepluch,Male,54,China,Central Maine Airport of Norridgewock,US,United States,NAM,North America,4/13/2022,OWK,Torin Le Leu,Delayed,Aegean Airlines,2,"""seats reservation was not allowed""",2nd September 2022,TRUE,"  We are both Star Alliance Gold status holders. We booked a full price Economy class Lufthansa tkt from MRS to Mykonos via MUC & ATH, at a price where seat selection is guaranteed. MRS-MUC-ATH with LH, ATH-JMK flight was an Aegean flight. After purchasing, seats reservation on ATH-JMK flight was not allowed. We wrote and call Aegean, no answer. 48 hours before that specific flight Aegean automatically booked 2 separate seats in the last row. We were allowed to change those seat, paying 6 Euros. This is so petty, that it is ridiculous.",A320,Couple Leisure,Economy Class,Athens to Mykonos,Aug-22,2,3,,1,,,1,no,satisfied,Loyal Customer,21,Personal Travel,Eco,4804,0,2,0,4,5,0,5,5,4,1,4,2,3,5,20,
147,XE,5951,CAK,ORD,3,345,95,0,pPkCA0,Francoise,Mustill,Female,76,Netherlands,Lawson Army Air Field (Fort Benning),US,United States,NAM,North America,7/21/2022,LSF,Carlye Egan,Delayed,Aegean Airlines,2,"""change those seat, paying 12 Euros""",2nd September 2022,TRUE,"  We booked a full price Economy class ticket from Lufthansa, at a price where seat selection is guaranteed. ATH-MUC flight was an Aegean flight. After purchasing, seats reservation on ATH-MUC flight was not allowed. We wrote and call Aegean, no answer. 48 hours before that specific flight Aegean automatically booked 2 separate seats in the back of the aircraft. We were allowed to change those seat, paying 12 Euros. ",A320 Neo,Couple Leisure,Economy Class,Athens to Munich,Sep-22,2,3,3,1,,,1,no,satisfied,Loyal Customer,26,Personal Travel,Eco,3466,0,2,0,4,2,0,2,2,3,1,3,2,4,2,0,0
148,OO,6480,IPL,YUM,3,346,34,0,ccOroQ,Peterus,Lettson,Male,70,Botswana,Ust-Maya Airport,RU,Russian Federation,EU,Europe,11/10/2022,UMS,Eugine Mainwaring,Delayed,Aegean Airlines,1,"""Aegean exceeded my expectations""",18th August 2022,TRUE,  Aegean exceeded my expectations. Didn't expected a snack and few drinks service on a few hours flight. I asked one extra beer when we started our descending and the crew handed out one with a smile. Way more better than other European airlines. I really hope they will earn five star airline status.,A320,Solo Leisure,Economy Class,Berlin to Thessaloniki,Jun-22,5,5,5,5,4,,5,yes,satisfied,Loyal Customer,30,Personal Travel,Eco,2825,0,2,0,4,1,0,1,1,4,1,2,2,3,1,0,0
149,OO,6843,EAU,CWA,3,346,32,0,z2zl1t,Yuri,Crossfield,Male,38,Peru,Dalby Airport,AU,Australia,OC,Oceania,5/15/2022,DBY,Crista Timewell,On Time,Aegean Airlines,5,"""I had to pay 50 euros more""",12th August 2022,TRUE,"  I showed them my ticket to board on the plane. They thought my suitcase was big, then weighed it, and also found my bagpack too big. They never showed me the number shown on the weight scale, or informed me about why my bagpack was considered too big. Instead, they were rude. After me insisting on knowing how many kilos my suitcase was, they told me it was 9 kilos (instead of 8!), for which I had to pay 50 euros more.  I feel that economy class passengers are treated with no respect in the airport, and Aegean attempts to take more money from them, making their life difficult in their airport. I would not recommend flying with Aegean. A sandwich and a cup of coffee on the airplane is not worthy of such bad customer service.",,Solo Leisure,Economy Class,Stuttgart to Thessaloniki via Athens,Aug-22,3,4,3,1,,,1,no,satisfied,Loyal Customer,36,Personal Travel,Eco,2561,0,2,0,4,2,0,2,2,2,2,2,4,4,2,0,0
150,UA,756,SFO,DEN,3,348,158,0,D6SsuG,Kirbee,Wrenn,Female,45,Armenia,Luƒçenec Airport,SK,Slovakia,EU,Europe,7/27/2022,LUE,Mary Hurch,On Time,Aegean Airlines,1,"""great flight and highly recommended""",11th August 2022,FALSE,"  Smooth check- in procedure at a very busy Athens Airport. Polite and efficient staff on hand to assist. Boarded a clean and shiny A321 Neo, greeted by smiling and courteous crew. Full flight, on time departure, usual high standard of onboard service. Good and clear PA announcements from cockpit in perfect English. Toilets were very clean. Landed early, bags arrived on belt without any issue. Thanks Aegean, great flight and highly recommended.",A321 Neo,Business,Economy Class,Athens to London Heathrow,Aug-22,4,5,5,5,5,5,5,yes,satisfied,Loyal Customer,49,Personal Travel,Eco,2762,0,2,0,4,2,0,4,2,4,1,4,3,4,2,0,15
151,OO,3099,OMA,MKE,3,349,81,1,ZzqP1s,Rici,Rein,Female,85,Russia,Meghauli Airport,NP,Nepal,AS,Asia,2/26/2022,MEY,Eleni Avent,Delayed,Aegean Airlines,1,"""Lost my luggage 3 days ago""",11th August 2022,TRUE,"  Lost my luggage 3 days ago, no call from Aegean or airport. Holiday ruined. We had to re-buy all our clothes again as they made us check in even our cabin luggage.",,Family Leisure,Economy Class,London to Istanbul via Athens,Aug-22,2,2,1,1,,,1,no,satisfied,Loyal Customer,49,Personal Travel,Eco,1184,0,2,0,4,1,2,4,3,3,2,3,2,3,2,12,0
152,9E,3718,ERI,DTW,3,350,65,1,V30YQC,Anestassia,Vauls,Female,20,Albania,Nikolai Airport,US,United States,NAM,North America,8/11/2022,NIB,Lucio Notley,On Time,Aegean Airlines,2,"""Gold Air cannot be reached""",2nd August 2022,TRUE,"  Lost my bag, no support or help from Aegean, trying to blame Gold Air. Gold Air cannot be reached either by phone or email. Aegean refuses to change return ticket to fly back to Crete early, only with extra charge can this be done. This trip is a complete waste of time.  Food / Snack served on the 45 min flight a drink and Pringles. ",,Business,Economy Class,Heraklion to Athens,Aug-22,3,3,1,1,,,1,no,satisfied,Loyal Customer,48,Personal Travel,Eco,1066,0,2,0,4,5,4,4,2,2,0,2,3,2,1,14,7
153,B6,107,BUF,JFK,3,350,83,0,zLM6wt,Virgil,Markussen,Male,79,Philippines,Bemidji Regional Airport,US,United States,NAM,North America,6/19/2022,BJI,Bird Boarder,Cancelled,Aegean Airlines,1,"""inappropriate delay of the flight""",29th July 2022,TRUE,"  After an extremely inappropriate delay of the flight, the boarding procedure was unbearably slowly conducted by the airline employees. Extensive waiting for the bus transport from gate to the aircraft and then 20 minutes of waiting in the aircraft for no reason .",,Business,Economy Class,Athens to Sofia,Jul-22,1,1,,1,,,1,no,satisfied,Loyal Customer,17,Personal Travel,Eco,1740,0,2,0,4,3,0,3,3,4,3,3,2,4,3,0,0
154,DL,1248,IAH,ATL,3,350,130,1,A6Rssr,Marlin,Yegorev,Male,25,Egypt,Muhammad Salahuddin Airport,ID,Indonesia,AS,Asia,8/28/2022,BMU,Saidee Sellers,Cancelled,Aegean Airlines,1,"""we still have no luggage""",11th July 2022,TRUE,"  Worst experience I‚Äôve ever had flying. Lost bags on the flight from Athens to Rome. It‚Äôs been about a week now and we still have no luggage. It‚Äôs cost us money, time and stress and Aegean don‚Äôt reply to emails or answer phones to update us. ",,Couple Leisure,Economy Class,Mykonos to Rome via Athens,Jul-22,1,1,,1,,,1,no,satisfied,Loyal Customer,10,Personal Travel,Eco,1970,0,2,0,4,3,0,3,3,1,3,4,4,3,3,0,0
155,DL,1985,DAY,ATL,3,350,114,0,UFOM9h,Clemmie,Harbertson,Male,76,Ukraine,"Magdeburg ""City"" Airport",DE,Germany,EU,Europe,12/06/2022,ZMG,Tadio Hayne,Cancelled,Aegean Airlines,9,"""Professional service on-board""",9th July 2022,FALSE,"  Athens Airport was extremely busy when I arrived. Proceeded to the Aegean Airlines check-in area which was manned by helpful staff and carried out self check-in. Met by polite staff at bag drop. Queues were starting to form at some counters, the one next to me was being held up by some irritating passengers who were questioning the baggage allowance for hand luggage. The Aegean website clearly states the weight permitted as do the various signs at check-in, yet some people pay no attention to this and continue to be rude and aggressive to check-in staff who are only doing their job, politely and professionally.  Boarded on time, full flight. Politely greeted at door by cabin crew. Professional service on-board. Landed early. Clear announcements from cockpit. Great flight. Recommended.",A321 Neo,Solo Leisure,Economy Class,Athens to London,Jul-22,5,5,5,5,4,5,5,yes,satisfied,Loyal Customer,55,Personal Travel,Eco,994,0,2,0,4,2,4,3,3,3,0,3,1,3,3,68,80
156,DL,2387,MKE,ATL,3,350,129,1,YfqTxa,Happy,Jaskowicz,Female,82,Mexico,Tsletsi Airport,DZ,Algeria,AF,Africa,11/01/2022,QDJ,Meridith Dibbe,Cancelled,Aegean Airlines,2,"""hand luggage to be checked in""",8th July 2022,TRUE,"  Just flew in from Istanbul to Athens on the way to London. The first leg was fine, however this review is about flight A3608 on July 8th 2022 from Athens to London. It seems to have become a habit by airlines to force hand luggage to be checked in which is an annoyance for anyone who is familiar with the wait this results in at Heathrow. The crew are nice and friendly and apart from a minor delay, the flight was on time. I specifically asked for a window seat and was placed in position 28A. It‚Äôs only when I got on that I realized this seat is on the emergency door and this aircraft type does not support a window on this position. ",A321 Neo,Solo Leisure,Economy Class,Athens to London,Jul-22,3,3,1,3,,,2,no,satisfied,Loyal Customer,48,Personal Travel,Eco Plus,2391,0,2,0,4,1,0,1,1,3,1,3,3,4,1,0,0
157,DL,2405,PHL,DTW,3,350,115,0,RDnvan,Quentin,Plaschke,Male,37,Syria,Groote Eylandt Airport,AU,Australia,OC,Oceania,3/30/2022,GTE,Honey Gallaway,On Time,Aegean Airlines,1,"""extra hand luggage I had to pay""",7th July 2022,TRUE,"  To include an extra hand luggage I had to pay +20% on the fare. Checking in I weighed my luggage, it was 1.2kg above. I was forced to give it to the hold and not allowed to remove a jumper from my luggage to my backpack. A checked in luggage would have been cheaper than the upgrade I paid for.  This is my worst travel experience in 2022.",,Solo Leisure,Premium Economy,London to Athens,Jul-22,1,1,,1,,,1,no,satisfied,Loyal Customer,58,Personal Travel,Eco,2032,0,2,0,4,4,0,4,4,3,5,2,2,4,4,0,0
158,DL,734,MCI,ATL,3,350,129,0,NzdL85,Paulie,Dunnet,Male,37,Serbia,Lemhi County Airport,US,United States,NAM,North America,1/23/2022,SMN,Ned Marnes,Delayed,Aegean Airlines,1,"""I was allowed 8kg""",3rd July 2022,TRUE,"  For two extra kilos you made me pay 40e. ‚ÄåI was flying Aegean Air from Thessaloniki to Athens today (flight A3 111) with economy/light ticket, which includes only one cabin bag of 8kilos. I did forget about this, and came to the airport with my cabin bag and a laptop backpack. After weighting my cabin bag, Aegean stuff said it was 10 kilos, I was allowed 8kg and only one luggage. I said I can put the backpack in the cabin bag, but they refused as this would make it heavier. They clearly didn't want to help me and actually told to to hurry up and pay the fine or I would miss the flight, as people were boarding. I later thought that I could have easily taken out my heavy jacket and trainers - I was wearing flip flops, and make my cabin bag much lighter, so with my laptop it would be a bit over 8 kilos. Very, very disappointing Aegean Air.",A320neo,Solo Leisure,Economy Class,Thessaloniki to Athens,Jul-22,2,2,,1,,,1,no,satisfied,Loyal Customer,50,Personal Travel,Eco,726,0,2,0,4,3,3,4,5,5,0,5,2,5,2,0,1
